Code,Theme,Theme.Code,Practice,Practice.Code,Subpractice,Subpractice.Code,Subpractice.S,Subpractice.Suffix,Definition,Notes,Linked.Tab,Linked.Col,Depreciated,Ref_Source,Ref_Name,Ref_Link,Ref_Match,Ref_Notes,Ref2_Source,Ref2_Name,Ref2_Link,Ref2_Match,Ref2_Notes
d14,Animals,Animals,Manure Management,MM,Manure Storage,MM-St,Manure Storage,NA,"Manure storage techniques such as heaps, pits or dry lots.",,Animals.Out,A.Level.Name,FALSE,,,,,,,,,,
d15,Animals,Animals,Manure Management,MM,Manure Treatment,MM-Tr,Manure Treat,NA,Techniques for treatment of manure.,,Animals.Out,A.Level.Name,FALSE,,,,,,,,,,
d16,Animals,Animals,Pasture Management,PM,Rotational Grazing,PM+RG,Grazing Rotation,NA,The movement of animals between different paddocks at intervals.,,Animals.Out,A.Level.Name,FALSE,,,,,,,,,,
d11,Animals,Animals,Pasture Management,PM,Improved Pasture (N fixing),PM+IP+N,Pasture Impr (Nfix),Nfix,The planting of pastures with leguminous forages.,,Animals.Out,A.Level.Name,FALSE,,,,,,,,,,
d12,Animals,Animals,Pasture Management,PM,Improved Pasture (Non N fixing),PM+IP-N,Pasture Impr (nonNfix),nonNfix,The planting of pastures with non-leguminous forages.,,Animals.Out,A.Level.Name,FALSE,,,,,,,,,,
d19,Animals,Animals,Pasture Management,PM,Controlled Grazing,PM+CG,Grazing Controlled,NA,"The restriction of animal movement within pastures. Controlled grazing is known by many names, such as rotational grazing, rotational stocking, intensive grazing and strip grazing. Typically a large pasture is subdivided into several smaller pastures (paddocks) by cross fencing and animals stocked in one of the paddocks. When the forage has been removed, cattle are rotated to the next paddock.",,Animals.Out,A.Level.Name,FALSE,,,,,,,,,,
d20,Animals,Animals,Pasture Management,PM,Cut & Carry,PM+CC,Grazing Cut & Carry,NA,"A system where animals are confined and feed is brought to them, also known as zero grazing.",,Animals.Out,A.Level.Name,FALSE,,,,,,,,,,
d1,Animals,Animals,Aquasilviculture,AqS,Aquasilviculture,AqS,Aquasilviculture,NA,"An aquaculture practice in combination with a sylviculture practice in close spatial proximity. The classic example of this practice is fish or crustacean farming in mangroves, to conserve or restore mangrove trees and produce food.",,Animals.Out,A.Level.Name,FALSE,,,,,,,,,,
f1,Postharvest,Postharvest,Harvest Method,HM,Harvest Technique,HM-Te,Harvest Technique,NA,"Changing the manner in which crops are harvested, for example using a new tool.",,PO.Out,PO.Level.Name,FALSE,,,,,,,,,,
f2,Postharvest,Postharvest,Harvest Method,HM,Harvesting Timing,HM-Ti,Harvest Timing,NA,"Changing the time when crops are harvested, for example moving to piecemeal harvesting from all-at-once or havesting in the morning compared to the heat of the day.",,PO.Out,PO.Level.Name,FALSE,,,,,,,,,,
f3,Postharvest,Postharvest,Storage,St,Improved Drying,St-Dr,Drying Improv,NA,Changing the manner in which crops are dried.,,PO.Out,PO.Level.Name,FALSE,,,,,,,,,,
f4,Postharvest,Postharvest,Storage,St,Improved Chemical Storage,St-Ch,Storage Impr Chem,NA,Using naturally derived or manufactured chemicals such as pesticides or preservatives improve storage. This could include adding actellic dust or fungicide to maize bags or fumigation of stores.,,PO.Out,PO.Level.Name,FALSE,,,,,,,,,,
f5,Postharvest,Postharvest,Storage,St,Improved Physical Storage,St-Ph,Storage Impr Phys,NA,"Improving the way food stuffs are stored such as Purdue improved crop storage (PICS) bags, use of granaries or improvements to granaries.",,PO.Out,PO.Level.Name,FALSE,,,,,,,,,,
h1,Non-CSA,Non-CSA,Non-CSA,,Non CSA,,,,"general, other, typically should not be used",,,,TRUE,,,,,,,,,,
h2,Non-CSA,Non-CSA,Agronomy;Agroforestry,,Monoculture,,Monoculture,,A single crop is grown in the experimental plot and is invariant over time.,This is the control for an intercropping experiment. Crop varieties may change.,,,FALSE,,,,,,,,,,
h38,Non-CSA,Non-CSA,Agronomy,,Continuous Cropping,,,,"A single crop is grown in the experimental plot, this is invariant over the course of the experiment.",This is the control for an intercropping experiment.,,,TRUE,,,,,,,,,,
h18,Non-CSA,Non-CSA,Agronomy;Agroforestry,,Simple Intercrop,,,,Control for improved intercropping.,,,,TRUE,,,,,,,,,,
h50,Non-CSA,Non-CSA,Agronomy;Agroforestry,,Simple Crop Rotation,,,,Control for improved rotations.,,,,TRUE,,,,,,,,,,
h24,Soil Management,Soil Management,Improved Fallow,,Natural or Bare Fallow,,Fallow Unimpr,,A fallowing practice where the land is left unmanaged between production periods.,This is the control practice for improved fallows.,,,FALSE,,,,,,,,,,
h6,Soil Management,Soil Management,Conventional Tillage,,Conventional Tillage,,Conv Till,,"Tillage that is not considered to be reduced, typically includes methods such as moldboard plough which invert the upper layers of the soil.","The definition depends on the context, for example ridge and furrow may be reduced in some instances, but conventional in others.",,,FALSE,,,,,,,,,,
h35,Soil Management,Soil Management,Crop Residue,,Crop Residues Removed,,Residue Removed,,Crop residues are removed from the field.,,,,FALSE,,,,,,,,,,
h36,Soil Management,Soil Management,Crop Residue,,Crop Residues Burnt,,Residue Burnt,,Crop residues are burnt (in the field).,,,,FALSE,,,,,,,,,,
h39,Soil Management,Soil Management,Crop Residue,,Crop Residues Grazed,,Residue Grazed,,Crop residues are grazed by livestock (in the field).,,,,FALSE,,,,,,,,,,
h37,Soil Management,Soil Management,Crop Residue,,Crop Residue Incorporated,,Residue Incorp,,Crop residues are incorporated into the field.,,,,FALSE,,,,,,,,,,
h55,Genetic improvement,Genetic improvement,Unimproved Variety,,Unimproved Variety,,Unimpr Variety,,"A crop variety that has not been improved through intensive crop breeding, for example a farmer's or local variety, or a landrace.",,,,FALSE,,,,,,,,,,
h7,Water Management,Water Management,Irrigation,,Fully Irrigated Control or Experiment,,Full Irrig,,The crop is fully irrigated.,A control that can be compared to experimental treatments that apply less water (e.g. deficit irrigation) or this code can be giving to control and treatment where both are irrigated (e.g. rice grown in paddies).,,,FALSE,,,,,,,,,,
h23,Water Management,Water Management,Irrigation,,No Irrigation Control or Rainfed Agriculture,,No Irrig,,"No irrigation used, rainfed agriculture.",A control practice that can be compared to the practice of supplemental irrigation.,,,FALSE,,,,,,,,,,
h10,Nutrient Management,Nutrient Management,Fertilizer,,Conventional input (fertilizer) use,,,,Addition of fertilizer without any specific measurement,,,,FALSE,,,,,,,,,,
h10.1,Nutrient Management,Nutrient Management,Fertilizer,,No fertilizers added,,No Fert,,No inputs of inorganic or organic fertilizer.,A control for fertilizers addition treatments.,,,FALSE,,,,,,,,,,
h10.2,Nutrient Management,Nutrient Management,Fertilizer,,Recommend rate of fertilizer,,,,Addition of recommended amount of fertilizer following soil tests. This is to be used when the papers specifically says the recommended rates.,,,,FALSE,,,,,,,,,,
h48,Non-CSA,Non-CSA,Agronomy,,Conventional rice management,,,,"A control for SRI, alternate wetting $drying, midseason drainage and reduced water use in Rice",,,,TRUE,,,,,,,,,,
h14,Energy,Energy,Cookstove,,Unimproved Stove Technology,,Cookstove Unimpr,,Use of traditional stoves for burning biomass fuels lile traditional three-stone; a control for improved cookstoves,A control for an improved cookstove.,,,FALSE,,,,,,,,,,
h15,Energy,Energy,Biogas/cookstove,,Conventional Biomass Feedstocks,,Biomass Feed Conv,,Use of normal/usual feedstocks in a biomass digestor.,,,,FALSE,,,,,,,,,,
h16,Energy,Energy,Biogas,,Predominant Biodigestor Model,,,,,,,,TRUE,,,,,,,,,,
h26,Energy,Energy,Cookstove,,Conventional Energy Sources,,Cookstove Conv Fuel,,A conventional or normal source of fuel.,A control for cookstove fuel switching.,,,FALSE,,,,,,,,,,
h17,Postharvest,Postharvest,Harvest Method,,Traditional harvesting method,,Harvest Trad,,Harvesting at usual times or with usual tools.,Control for improved/changed harvesting technique and/or timing.,,,FALSE,,,,,,,,,,
h21,Postharvest,Postharvest,Storage,,Unimproved Storage Structure,,Storage Unimpr Phys,,"Storing feeds/seeds in an unimproved manner, such as a traditional granary or storeroom.",Control for Improved Physical Storage.,,,FALSE,,,,,,,,,,
h22,Postharvest,Postharvest,Storage,,Unimprove or No Preservation Technique,,Storage Unimpr Chem,,Typically no method is used to preserve stored foods or the method is considered to be unimproved.,Control for Improved Chemical Storage.,,,FALSE,,,,,,,,,,
h30,Postharvest,Postharvest,Storage,,Uimproved Drying Technique,,Drying Unimpr,,No or an unimproved drying technique is used to preserve food for storage.,Control for Improved Improved Drying.,,,FALSE,,,,,,,,,,
h60,Animals,Animals,Feed Addition; Feed Substitution,,Basal or Conventional Diet,,Diet Control,,A diet fed to animals without additional of anything.,A control for addition (supplementation) of feeds.,,,FALSE,,,,,,,,,,
h61,Animals,Animals,Feed Addition; Feed Substitution,,Conventional Supplement Use,,,,Supplement given to animals by the farmer or deemed control by author and is,A control for addition (supplementation) or substitution of feeds.,,,FALSE,,,,,,,,,,
h10.3,Animals,Animals,Manure Management,,Conventional Manure Handling,,Manure Hand Conv,,Conventional Manure handling (farmer practice),,,,FALSE,,,,,,,,,,
h11,Animals,Animals,Pasture Management,,Conventional Pasture Management,,Pasture Man Conv,,Conventional pasture management.,This could be the traditional or farmer practice or a practice the authors state as an unimproved control practice.,,,FALSE,,,,,,,,,,
h55.1,Animals,Animals,Genetic Improvement,,Unimproved Breed,,Breed Unimpr,,A local or otherwise unimproved animal breed.,A control for improved breeds/hybrid and cross breeds.,,,FALSE,,,,,,,,,,
h66.1,Non-CSA,Non-CSA,Agronomy;Agroforestry,,Chemical Weeding (Herbicides),,Weed Chem,,Suppression of weed growth or killing weeds using chemicals,,,,FALSE,,,,,,,,,,
h66.2,Non-CSA,Non-CSA,Agronomy;Agroforestry,,Hand Weeding,,Weed Hand,,"Extraction of weeds by hands through pulling or use of tools like panga, hoe etc.",,,,FALSE,,,,,,,,,,
h6.1,Soil Management,Soil Management,No-Till (Off-season),,,,,,Used in the unusal situation where off-season tillage erroneously adds a no-tillage ERA practice to a rotation sequence (add example from HK0314),,,,FALSE,,,,,,,,,,
h6.2,Soil Management,Soil Management,Reduced Tillage (Off-season),,,,,,Used in the unusal situation where off-season tillage erroneously adds a reduced ERA practice to a rotation sequence (add example from HK0314),,,,FALSE,,,,,,,,,,
h3,Water Management,Water Management,Planting,,Transplanting Seedlings. This practice code has only been applied to the 2018 dataset,,,,"Transplanting young seedlings, a practice commonly used to improve rice management in irrigated systems.",,,,FALSE,,,,,,,,,,
