Code,Theme,Theme.Code,Practice,Practice.Code,Subpractice,Subpractice.Code,Subpractice.S,Subpractice.Suffix,Definition,Notes,Linked.Tab,Linked.Col,Depreciated,Ref_Source,Ref_Name,Ref_Link,Ref_Match,Ref_Notes,Ref2_Source,Ref2_Name,Ref2_Link,Ref2_Match,Ref2_Notes
b58,Green Water Management,Green Water Management,Water Harvesting,WH,Trench,WH+Tr,Trench,NA,A trench dug along the contour lines of a field to capture water. This practice should have no associated bunds or banks with the trench.,,WH.Out,WH.Level.Name,FALSE,,,,,,,,,,
b13,Blue Water Management,Blue Water Management,Improved Rice Management,IRM,Alternate Wetting & Drying (AWD),IRM+AWD,AWD,NA,"Repeated flooding and draining of paddy rice fields, managed responsively in relation to soil moisture levels.",,NA,NA,FALSE,,,,,,,,,,
b14.1,Blue Water Management,Blue Water Management,Improved Rice Management,IRM,Midseason Drainage,IRM+MD,Midseason Drainage,NA,"The paddy rice field is drained during the season, but usually only once.",,NA,NA,FALSE,,,,,,,,,,
b14.2,Blue Water Management,Blue Water Management,Improved Rice Management,IRM,Reduced Water Use in Rice,IRM+RWU,Reduced Water Use,NA,Practices that reduce water use in rice that are not alternate wetting & drying (AWD) or midseason drainage. Consider creating a new practice rather than using this code.,,NA,NA,FALSE,,,,,,,,,,
b15,Blue Water Management,Blue Water Management,Improved Rice Management,IRM,System of Rice Intensification (SRI),SRI,SRI,NA,"If possible it is best to unpack SRI into its component practices rather than using this practice code. If impossible to disaggregate the SRI practice then use this code. 
SRI is a system package which can include early transplanting (8-12 days), 25cm spacing and alternate wet and dry. Identified by authors.",,NA,NA,TRUE,,,,,,,,,,
b3.1,Crop Management,Crop Management,Crop Rotation,CRo,Rotation (N fixing),CRo+N,Rotation (Nfix),Nfix,"A crop rotation sequence of two or more legumes.
A general definition of rotation is that more than one crop is grown in the same location, but across different growing season (diversification in time). Different varieties of the same crop do not count as rotation. A crop is not counted in a rotation sequence when it is obviously a minor intercrop to a main crop which is invariant over time (typically there is standard planting of the main crop from year to year and the intercrop is squeezed in-between the rows of the main crop, for example cowpea planted at a low density inbetween maize rows).",Crops should be grown for harvest and not as cover crop or green manure.,Rot.Out,ED.Rot,FALSE,,,,,,,,,,
b3.2,Crop Management,Crop Management,Crop Rotation,CRo,Rotation (Non N fixing),CRo-N,Rotation (nonNfix),nonNfix,"A crop rotation sequence with two or more non-legumes.
A general definition of rotation is that more than one crop is grown in the same location, but across different growing season (diversification in time). Different varieties of the same crop do not count as rotation.",Crops should be grown for harvest and not as cover crop or green manure.,Rot.Out,ED.Rot,FALSE,,,,,,,,,,
b43,Crop Management,Crop Management,Crop Rotation,CRo,Rotation (N fixing & Non N fixing),CRo±N,Rotation (Mixed),Mixed,"A crop rotation sequence containing non-leguminous and leguminous crops (e.g. a maize/bean rotation a maize-bean intercrop followed by cassava). 
A general definition of rotation is that more than one crop is grown in the same location, but across different growing season (diversification in time). Different varieties of the same crop do not count as rotation. A crop is not counted in a rotation sequence when it is obviously a minor intercrop to a main crop which is invariant over time (typically there is standard planting of the main crop from year to year and the intercrop is squeezed in-between the rows of the main crop, for example cowpea planted at a low density inbetween maize rows).",Crops should be grown for harvest and not as cover crop or green manure.,Rot.Out,ED.Rot,FALSE,,,,,,,,,,
b44,Crop Management,Crop Management,Crop Rotation,,Complex Rotation,,Rotation (Complex),Complex,"A crop rotation sequence with three or more species or rotations with different annual cycles. If intercropping is present in a complex rotation then this should also be captured with an intercropping code. A species is not counted towards a rotation sequence species count when it is obviously a minor intercrop to a main crop which remains invariant (typically there is standard planting of the main crop from year to year and the intercrop is squeezed in-between the rows of the main crop, for example cowpea planted at a low density inbetween maize rows). If it is not clear which crops are main or minor or not then count them all towards a complex rotation total (so an experiement might have maize one year, then the next year some maize rows are replaced with beans, in this case the beans are counted as a rotation crop and the number of species is two). 
A general definition of rotation is that more than one crop is grown in the same location, but across different growing season (diversification in time). Different varieties of the same crop do not count as rotation. Crops should be grown for harvest and not as cover crop or green manure.",,Rot.Out,ED.Rot,TRUE,,,,,,,,,,
b31,Crop Management,Crop Management,Crop Rotation,,Intercrop Rotation,,Rotation (Int Only),Int Only,"Rotation where a main crop remains the same between seasons (no change in spatial location or crop identity), but the minor intercrop is not always present. If the same crop is intercropped throughout the sequence (e.g. Maize-Beans/Maize/Maize-Beans) then this requires a Partial Intercropping code (b50.1, b50.2 or b50.3) or if the intercrop changes throughout the sequence (e.g. Maize-Beans/Maize-Millet/Maize-Beans) this requires a Complex Intercrop Rotation code (b57). If the intercrop is mostly one crop for a long sequence, but rarely something else is planted, we still consider this to be relevant to the Partial Intercropping code.
A general definition of rotation is that more than one crop is grown in the same location, but across different growing season (diversification in time). Different varieties of the same crop do not count as rotation. A crop is not counted in a rotation sequence when it is obviously a minor intercrop to a main crop which is invariant over time (typically there is standard planting of the main crop from year to year and the intercrop is squeezed in-between the rows of the main crop, for example cowpea planted at a low density inbetween maize rows). Crops should be grown for harvest and not as cover crop or green manure (if the latter see the green manure practices).",,Rot.Out,ED.Rot,TRUE,,,,,,,,,,
b25,Crop Management,Crop Management,Intercropping,In,Intercrop (N fixing & Non N fixing),In±N,Intercrop (Mixed),Mixed,"An intercropping system with a legume and non-legume. 
Intercropping is where more than one crop is grown at the same time in the same area of management (typically a single field), this is diversification in space rather than diversification in time. Crops should be grown for harvest and not as cover crop or green manure (if the latter see the green manure practices).",,Int.Out,ED.Int,FALSE,,,,,,,,,,
b50.1,Crop Management,Crop Management,Intercropping,In,Intercrop (Non N fixing),In-N,Intercrop (nonNfix),nonNfix,"An intercropping system with two non-legumes.
Intercropping is where more than one crop is grown at the same time in the same area of management (typically a single field), this is diversification in space rather than diversification in time. Crops should be grown for harvest and not as cover crop or green manure (if the latter see the green manure practices).",,Int.Out,ED.Int,FALSE,,,,,,,,,,
b50.2,Crop Management,Crop Management,Intercropping,In,Intercrop (N fixing),In+N,Intercrop (Nfix),Nfix,"An intercropping system with two or more legumes (edible or marketable).
Intercropping is where more than one crop is grown at the same time in the same area of management (typically a single field), this is diversification in space rather than diversification in time. Crops should be grown for harvest and not as cover crop or green manure (if the latter see the green manure practices).",,Int.Out,ED.Int,FALSE,,,,,,,,,,
b50.3,Crop Management,Crop Management,Intercropping,,Complex Intercrop,,Intercrop (Complex),Complex,"An intercropping system with three or more species.
Intercropping is where more than one crop is grown at the same time in the same area of management (typically a single field), this is diversification in space rather than diversification in time. If in combination with a rotation sequence intercropping should be present in every year of the cropping cycle, if it is not consider using partial intercrop codes. Crops should be grown for harvest and not as cover crop or green manure (if the latter see the green manure practices).",,Int.Out,ED.Int,,,,,,,,,,,
b50.4,Crop Management,Crop Management,Intercropping,In,Intercrop (Unspecified),In,Intercrop (Unsp.),Unsp.,"An intercropping system is present, but no details on composition are available.
Intercropping is where more than one crop is grown at the same time in the same area of management (typically a single field), this is diversification in space rather than diversification in time. Crops should be grown for harvest and not as cover crop or green manure (if the latter see the green manure practices).",Only use this practice where there are no details presented about an intercropping paper. All we know is that intercropping was present.,Int.Out,ED.Int,FALSE,,,,,,,,,,
b55.1,Crop Management,Crop Management,Intercropping,,Partial Intercrop (N fixing & Non N fixing),,Intercrop (Part; Mixed),Part;Mixed,"An intercropping system with a legume and non-legume where intercropping is not present every season (spatial diversification that is variable over time). For example a repeating sequence of Maize followed by a Maize-Cowpea intercrop, this would also get an intercrop rotation code.
Intercropping is where more than one crop is grown at the same time in the same area of management (typically a single field), this is diversification in space rather than diversification in time. Crops should be grown for harvest and not as cover crop or green manure (if the latter see the green manure practices).",,Int.Out,ED.Int,TRUE,,,,,,,,,,
b55.2,Crop Management,Crop Management,Intercropping,,Partial Intercrop (Non N fixing),,Intercrop (Part; nonNfix),Part;nonNfix,"An intercropping system with two non-legume crops where intercropping is not present every season (spatial diversification that is variable over time). For example a repeating sequence of Maize followed by a Maize-Cowpea intercrop, this would also get an intercrop rotation code.
Intercropping is where more than one crop is grown at the same time in the same area of management (typically a single field), this is diversification in space rather than diversification in time. Crops should be grown for harvest and not as cover crop or green manure (if the latter see the green manure practices).",,Int.Out,ED.Int,TRUE,,,,,,,,,,
b55.3,Crop Management,Crop Management,Intercropping,,Partial Intercrop (N fixing),,Intercrop (Part; Nfix),Part;Nfix,"An intercropping system with two legume crops where intercropping is not present every season (spatial diversification that is variable over time). For example a repeating sequence of Maize followed by a Maize-Cowpea intercrop, this would also get an intercrop rotation code.
Intercropping is where more than one crop is grown at the same time in the same area of management (typically a single field), this is diversification in space rather than diversification in time. Crops should be grown for harvest and not as cover crop or green manure (if the latter see the green manure practices).",,Int.Out,ED.Int,TRUE,,,,,,,,,,
b57,Crop Management,Crop Management,Intercropping,,Complex Intercrop Rotation,,Intercrop (Rot; Complex),Rot Complex,"There is a main crop (there is no change in spatial location or crop identity) and intercrop (minor) crop sequence , but the nature of the main-intercrop pairing changes between seasons (e.g. Maize-Beans/Maize-Millet/Maize-Beans) , this can be thought of as rotation in the intercrop (minor crop). If the intercrop is mostly one crop for a long sequence, but rarely something else is planted, we still consider this to be relevant to the Partial Intercropping code.
Intercropping is where more than one crop is grown at the same time in the same area of management (typically a single field), this is diversification in space rather than diversification in time. Crops should be grown for harvest and not as cover crop or green manure (if the latter see the green manure practices).",,Rot.Out,ED.Rot,TRUE,,,,,,,,,,
b59,Crop Management,Crop Management,Intercropping or Rotation,In/CRo,Intercropping or Rotation (N fixing & Non N fixing),In/CRo±N,Int or Rot (Mixed),Mixed,"Only use this practices where a paper states that legume intercropping or rotation was used, but the outcomes do not distinguish between the two.",This outcome will typically relate to farmer trials or surveys.,Rot.Out,ED.Rot,FALSE,,,,,,,,,,
b4,Genetic improvement,Genetic improvement,Improved Varieties,IV,Drought Tolerance,IV+DT,Seed Drought,NA,An improved crop variety bred for potential resistance to drought.,,Var.Out,V.Level.Name,FALSE,,,,,,,,,,
b5,Genetic improvement,Genetic improvement,Improved Varieties,IV,Heat Tolerance,IV+HT,Seed Heat,NA,An improved crop variety bred for potential resistance to heat.,,Var.Out,V.Level.Name,FALSE,,,,,,,,,,
b6,Genetic improvement,Genetic improvement,Improved Varieties,IV,Salinity Tolerance,IV+ST,Seed Salt,NA,An improved crop variety bred for potential resistance to salinity.,,Var.Out,V.Level.Name,FALSE,,,,,,,,,,
b69,Genetic improvement,Genetic improvement,Improved Varieties,IV,Improved Seeds,IV,Seed Improv,NA,"An improved crop variety bred for a specific quality other than drought, heat or salinity resistance (e.g. early maturity/short season or improved yields).",,Var.Out,V.Level.Name,FALSE,,,,,,,,,,
b16,Nutrient Management,Nutrient Management,Inorganic Fertilizer,IF,Inorganic K Inputs,IF+K,Inputs K,NA,"The addition of potassium (K) inorganic inputs to fields, typically to test application timing or amount.",,Fert.Out,F.Level.Name,FALSE,,,,,,,,,,
b17,Nutrient Management,Nutrient Management,Inorganic Fertilizer,IF,Inorganic N Inputs,IF+N,Inputs N,NA,"The addition of nitrogen (N) inorganic inputs to fields, typically to test application timing or amount.",,Fert.Out,F.Level.Name,FALSE,,,,,,,,,,
b21,Nutrient Management,Nutrient Management,Inorganic Fertilizer,IF,Inorganic P Inputs,IF+P,Inputs P,NA,"The addition of phosphorous (P) inorganic inputs to fields, typically to test application timing or amount.",,Fert.Out,F.Level.Name,FALSE,,,,,,,,,,
b64,Nutrient Management,Nutrient Management,Inorganic Fertilizer,IF,Inorganic Micronutrients Inputs,IF+Mi,Inputs Micro,NA,"The addition of micronutrients such as Fe, B, Cu, Mo, Zn, Mn, Cl, Ni, or Si typically to test application timing or amount.",,Fert.Out,F.Level.Name,FALSE,,,,,,,,,,
b23,Nutrient Management,Nutrient Management,Inorganic Fertilizer,IF,Urea,IF+Ur,Inputs Urea,NA,"The addition of urea (a source of nitrogen) to fields, typically to test application timing or amount.",,Fert.Out,F.Level.Name,FALSE,,,,,,,,,,
b29,Nutrient Management,Nutrient Management,Organic Fertilizer,OF,Compost,OF+Co,Inputs Compost,NA,"Application of composted plant material to the field, typically to test application timing or amount. Composts are organic materials which have been piled, moistened, and allowed to undergo biological decomposition","Typically identified by author. Include composted manures under the Manure practice, not here.",Fert.Out,F.Level.Name,FALSE,,,,,,,,,,
b30,Nutrient Management,Nutrient Management,Organic Fertilizer,OF,Manure,OF+Ma,Inputs Manure,NA,"Application of animal manure to the field, typically to test application timing or amount. This does not include biosolids such as sewage which have their own practice codes.",Include composted manures here.,Fert.Out,F.Level.Name,FALSE,,,,,,,,,,
b75,Nutrient Management,Nutrient Management,Organic Fertilizer,OF,Kraaling or Parcage,OF+Kr,Inputs Kraaling,NA,A south and west African method of housing animals at night in crop fields to produce manure.,,Fert.Out,F.Level.Name,FALSE,,,,,,,,,,
b73,Nutrient Management,Nutrient Management,Organic Fertilizer,OF,Organic (Other),OFO,Inputs Other Organic,NA,An organic input that does not match any other category in ERA.,Please notify ERA team if you use this code.,Fert.Out,F.Level.Name,FALSE,,,,,,,,,,
b74,Nutrient Management,Nutrient Management,Organic Fertilizer,OF,Ash,OF+A,Inputs Ash,NA,Application of plant ash to fields.,,Fert.Out,F.Level.Name,FALSE,,,,,,,,,,
b67,Nutrient Management,Nutrient Management,Organic Fertilizer,OF,Biosolids,OF+Bi,Inputs Biosolids,NA,"Biosolids are treated and processed sewage sludge applied to fields as a fertilizer. Biosolids do not include industrial waste products, e.g. sugar production waste, ethanol production waste.",,Fert.Out,F.Level.Name,FALSE,,,,,,,,,,
c1,Energy,Energy,Biogas,BG,Biogas,BG,Biogas Prod,NA,Biogas production from from anaerobic biodigesters.,"The comparison for this practice can be wood fuel or charcoal production as traditional energy sources (the outcomes would be cost, labor, fuel use, cooking time, etc.).",E.Out,E.Level.Name,FALSE,,,,,,,,,,
c4,Energy,Energy,Biogas,,Biofertilizer,,Biofertilizer,NA,Fertilizer (biofertilizer) produced using a biodigestor slurry.,USE COMPOST CODE b29,E.Out,E.Level.Name,TRUE,,,,,,,,,,
c3,Energy,Energy,Biogas,BG,Biogas Switching,BG+Sw,Biogas Switch,NA,Switching of biodigestors biomass feedstocks.,Biodigestor papers only.,E.Out,E.Level.Name,FALSE,,,,,,,,,,
c2,Energy,Energy,Cookstove,CS,Improved Cookstoves,CS,Cookstove Improv,NA,"Improved cookstove designed to burn biomass fuels in a cleaner and more efficient manner than conventional practice (e.g., traditional three-stone fires).",,E.Out,E.Level.Name,FALSE,,,,,,,,,,
c5,Energy,Energy,Cookstove,CS,Cookstove Switching,CS+Sw,Cookstove Switch,NA,Switching cookstove biomass feedstocks.,Cooking fuel studies only. Changing the source of fuel doesn't count (e.g. unsustainable wood from source A vs sustianable fuel from source B).,E.Out,E.Level.Name,FALSE,,,,,,,,,,
d17.1,Animals,Animals,Feed Addition,FA,Crop Fodders (Added),FA+CF,Feed Crop (Add),Add,"Feeds added to animal diets that come from non-woody crops not usually grown for fodder, but for another purpose (e.g. consumption). These can be crop grain. field residues (for example maize stalks left over once the grain component has been harvested) and or processing residues (for example the maize bran produced as a byproduct of milling flour). Soyabeans fit in this category as they are grown for human consumption and livestock feed.",Feeds are added compared to a control practice (basal diet) that does not contain items which would gain the same ERA classfication. Control diets are often hay ad libitum or hay ad libitum + maize stover.,Animals.Out,A.Level.Name,FALSE,,,,,,,,,,
d17.2,Animals,Animals,Feed Addition,FA,Non Crop Fodders (Added),FA+NC,Feed NonCrop (Add),Add,"Feeds added to animal diets that are non-woody crops grown primarily for fodder (e.g., alfafa or clover grown to feed to cattle) or non-woody plants harvested from non-cropped areas (e.g., forage grasses such as napier grass grown to stabilize terraces, cactus harvested from boundary fences, wild growing plants in wayside or fallows, algae, etc.).",Feeds are added compared to a control practice (basal diet) that does not contain items which would gain the same ERA classfication. Control diets are often hay ad libitum or hay ad libitum + maize stover.,Animals.Out,A.Level.Name,FALSE,,,,,,,,,,
d17.3,Animals,Animals,Feed Addition,FA,Agroforestry Fodders (Added),FA+AF,Feed AgFor (Add),Add,Feeds added to animal diets that are from agroforestry shrub or tree fodders or other woody plants.,Feeds are added compared to a control practice (basal diet) that does not contain items which would gain the same ERA classfication. Control diets are often hay ad libitum or hay ad libitum + maize stover.,Animals.Out,A.Level.Name,FALSE,,,,,,,,,,
d17.4,Animals,Animals,Feed Addition,FA,Animal Manures (Added),FA+AM,Feed Manure (Add),Add,Feeds added to animal diets that are animal manures.,Feeds are added compared to a control practice (basal diet) that does not contain items which would gain the same ERA classfication. Control diets are often hay ad libitum or hay ad libitum + maize stover.,Animals.Out,A.Level.Name,FALSE,,,,,,,,,,
d17.5,Animals,Animals,Feed Addition,FA,Other Feed (Added),FA+O,Feed Other (Add),Add,"Feeds added to animal diets that are non-plant or non-manure based materials. These typically include materials that are the by-product of animal processing (e.g., bone meal or fish meal).",Feeds are added compared to a control practice (basal diet) that does not contain items which would gain the same ERA classfication. Control diets are often hay ad libitum or hay ad libitum + maize stover.,Animals.Out,A.Level.Name,FALSE,,,,,,,,,,
d18.1,Animals,Animals,Feed Substitution,FS,Crop Fodders (Substituted),FS+CF,Feed Crop (Sub),Sub,"Components of a basal diet fully or partially substituted for residues from crops not primarily grown for fodder, but for another purpose (e.g. consumption). These can be field residues (for example maize stalks left over once the grain component has been harvested) and or processing residues (for example the maize bran produced as a byproduct of milling flour).",Substitutions are typically defined by the author. Usually they are looking to substitute a conventional (e.g. purchased diet) with cheaper or more sustainable alternatives.,Animals.Out,A.Level.Name,FALSE,,,,,,,,,,
d18.2,Animals,Animals,Feed Substitution,FS,Non Crop Fodders (Substituted),FS+NC,Feed NonCrop (Sub),Sub,"Components of a basal diet fully or partially substituted for non-woody crops grown primarily for fodder (e.g., alfafa or clover grown to feed to cattle) or non-woody plants harvested from non-cropped areas (e.g., forage grasses such as napier grass grown to stabilize terraces, cactus harvested from boundary fences, wild growing plants in wayside or fallows, algae, etc.). Feeds are added compared to a base practice control such as hay ad libitum only.",Substitutions are typically defined by the author. Usually they are looking to substitute a conventional (e.g. purchased diet) with cheaper or more sustainable alternatives.,Animals.Out,A.Level.Name,FALSE,,,,,,,,,,
d18.3,Animals,Animals,Feed Substitution,FS,Agroforestry Fodders (Substituted),FS+AF,Feed AgFor (Sub),Sub,Components of a basal diet fully or partially substituted for agroforestry shrub or tree fodders (woody plants).,Substitutions are typically defined by the author. Usually they are looking to substitute a conventional (e.g. purchased diet) with cheaper or more sustainable alternatives.,Animals.Out,A.Level.Name,FALSE,,,,,,,,,,
d18.4,Animals,Animals,Feed Substitution,FS,Animal Manures (Substituted),FS+AM,Feed Manure (Sub),Sub,Components of a basal diet fully or partially substituted for animal manures.,Substitutions are typically defined by the author. Usually they are looking to substitute a conventional (e.g. purchased diet) with cheaper or more sustainable alternatives.,Animals.Out,A.Level.Name,FALSE,,,,,,,,,,
d18.5,Animals,Animals,Feed Substitution,FS,Other Feed (Substituted),FS+O,Feed Byproducts (Sub),Sub,"Components of a basal diet fully or partially substituted with non-plant and non-manure based materials. These typically include materials for the by-product of animal processing (e.g., bone meal or fish meal).",Substitutions are typically defined by the author. Usually they are looking to substitute a conventional (e.g. purchased diet) with cheaper or more sustainable alternatives.,Animals.Out,A.Level.Name,FALSE,,,,,,,,,,
d22.1,Animals,Animals,Feed Processing,FP,Chemically Processed Feed,FP+Ch,Feed Chem Process,NA,"Fodders that have been chemically processed, for example urea-treated stover or fermented fodders. Silage is a type of fodder made from green foliage crops which have been preserved by acidification, achieved through fermentation.",,Animals.Out,A.Level.Name,FALSE,,,,,,,,,,
d22.2,Animals,Animals,Feed Processing,FP,Mechanically Processed Feed,FP+Me,Feed Mech Process,NA,"Fodders or plant wastes that have been mechanically processed, for example chopped or pelletted grasses or ground orange peel.",,Animals.Out,A.Level.Name,FALSE,,,,,,,,,,
d22.3,Animals,Animals,Feed Processing,FP,Concentrated Feed,FP+Co,Feed Concentrates,NA,"Non-forage feeds rich in energy and protein. Concentrates include feeds such as maize bran, cotton seed cake, molasses, fish meal and bean cake. Non-forage feeds may use energy or protein rich part plants such as seeds, whereas forage feeds are mainly plant leaves and stems.",,Animals.Out,A.Level.Name,FALSE,,,,,,,,,,
d9,Animals,Animals,Genetic Improvement,GI,Improved Breeds,GI-Im,Breed Impr,NA,"The use of improved animal breeds, these are animals bred for specific traits usually productivity (typically breeds exotic to Africa like Friesen, Holstein or Jersey cows).",,Var.Out,V.Level.Name,FALSE,,,,,,,,,,
d10,Animals,Animals,Genetic Improvement,GI,Hybridization or Cross Breeding,GI-Hy,Breed Hybrid,NA,"The use of animal cross breeds produced by the mating (hybridization) of individuals of different breeds, varieties, or species.",,Var.Out,V.Level.Name,FALSE,,,,,,,,,,
d13,Animals,Animals,Manure Management,MM,Manure Collection,MM-Co,Manure Collection,NA,"Techniques to collect manure, e.g, increased frequency of collection and removal from the kraal.",,Animals.Out,A.Level.Name,FALSE,,,,,,,,,,
